{
  "name": "fs.find",
  "version": "1.0.0",
  "purpose": "Find files inside the workspace by name, glob or content; patterns are size-capped and '..' is rejected after canonicalization.",
  "input_schema": {
    "type": "object",
    "additionalProperties": false,
    "required": ["path", "mode", "pattern"],
    "properties": {
      "path": {
        "type": "string",
        "minLength": 1,
        "maxLength": 4096
      },
      "mode": {
        "type": "string",
        "enum": ["name", "glob", "content"]
      },
      "pattern": {
        "type": "string",
        "minLength": 1,
        "maxLength": 256
      },
      "max_results": {
        "type": "integer",
        "minimum": 1,
        "maximum": 1000
      }
    }
  },
  "output_schema": {
    "type": "object",
    "additionalProperties": false,
    "required": ["matches", "truncated"],
    "properties": {
      "matches": {
        "type": "array",
        "items": {
          "type": "string"
        }
      },
      "truncated": {
        "type": "boolean"
      }
    }
  },
  "permission_class": "AUTO_READ",
  "capabilities": {
    "fs": "read_scoped",
    "net": "none",
    "proc": "none"
  },
  "timeout_s": 30,
  "output_limits": {
    "max_stdout_bytes": 200000,
    "max_stderr_bytes": 65536,
    "max_result_chars": 200000
  },
  "concurrency": "shared_read",
  "idempotent": true,
  "dry_run": false,
  "rollback": "none",
  "redaction": ["paths", "secrets"],
  "path_scope": "workspace",
  "tests": [
    "tests/unit/tools/test_readonly_tools.py",
    "tests/integration/tools/test_readonly_sandbox.py"
  ]
}
