{
  "name": "fs.list",
  "version": "1.0.0",
  "purpose": "List directory entries inside the workspace, sorted, to a bounded depth (default 4).",
  "input_schema": {
    "type": "object",
    "additionalProperties": false,
    "required": ["path"],
    "properties": {
      "path": {
        "type": "string",
        "minLength": 1,
        "maxLength": 4096
      },
      "depth": {
        "type": "integer",
        "minimum": 1,
        "maximum": 4
      }
    }
  },
  "output_schema": {
    "type": "object",
    "additionalProperties": false,
    "required": ["entries", "truncated"],
    "properties": {
      "entries": {
        "type": "array",
        "items": {
          "type": "object",
          "additionalProperties": false,
          "required": ["path", "type"],
          "properties": {
            "path": {
              "type": "string"
            },
            "type": {
              "type": "string",
              "enum": ["file", "dir", "symlink", "other"]
            },
            "size": {
              "type": "integer",
              "minimum": 0
            }
          }
        }
      },
      "truncated": {
        "type": "boolean"
      }
    }
  },
  "permission_class": "AUTO_READ",
  "capabilities": {
    "fs": "read_scoped",
    "net": "none",
    "proc": "none"
  },
  "timeout_s": 10,
  "output_limits": {
    "max_stdout_bytes": 50000,
    "max_stderr_bytes": 65536,
    "max_result_chars": 50000
  },
  "concurrency": "shared_read",
  "idempotent": true,
  "dry_run": false,
  "rollback": "none",
  "redaction": ["paths", "secrets"],
  "path_scope": "workspace",
  "tests": [
    "tests/unit/tools/test_readonly_tools.py",
    "tests/integration/tools/test_readonly_sandbox.py"
  ]
}
